[
  {"raw":"ss://cipher:pass1@srv1.example.com:8388","tag":"ss-1","type":"ss","config":{"type":"ss","server":"srv1.example.com","port":8388,"cipher":"aes-256-gcm","password":"pass1","udp":true}},
  {"raw":"ss://cipher:pass2@srv2.example.com:8388","tag":"ss-2","type":"ss","config":{"type":"ss","server":"srv2.example.com","port":8388,"cipher":"chacha20-ietf-poly1305","password":"pass2","udp":false}},
  {"raw":"ss://cipher:pass3@srv3.example.com:8388","tag":"ss-3","type":"ss","config":{"type":"ss","server":"srv3.example.com","port":8388,"cipher":"aes-128-gcm","password":"pass3","udp":true}},
  {"raw":"ss://cipher:pass4@srv4.example.com:8388","tag":"ss-4","type":"ss","config":{"type":"ss","server":"srv4.example.com","port":8388,"cipher":"aes-256-cfb","password":"pass4","udp":false}},
  {"raw":"ss://cipher:pass5@srv5.example.com:8388","tag":"ss-5","type":"ss","config":{"type":"ss","server":"srv5.example.com","port":8388,"cipher":"rc4-md5","password":"pass5","udp":true}},
  {"raw":"vmess://uuid1@srv1.example.com:443","tag":"vmess-1","type":"vmess","config":{"type":"vmess","server":"vm1.example.com","port":443,"uuid":"uuid1","alter_id":0,"tls":{"enabled":true,"sni":"vm1.example.com"},"transport":{"type":"ws","path":"/ws1","host":"vm1.example.com"}}},
  {"raw":"vmess://uuid2@srv2.example.com:443","tag":"vmess-2","type":"vmess","config":{"type":"vmess","server":"vm2.example.com","port":443,"uuid":"uuid2","alter_id":0,"tls":{"enabled":false},"transport":{"type":"none"}}},
  {"raw":"vmess://uuid3@srv3.example.com:443","tag":"vmess-3","type":"vmess","config":{"type":"vmess","server":"vm3.example.com","port":443,"uuid":"uuid3","alter_id":5,"tls":{"enabled":true},"transport":{"type":"tcp"}}},
  {"raw":"vmess://uuid4@srv4.example.com:443","tag":"vmess-4","type":"vmess","config":{"type":"vmess","server":"vm4.example.com","port":443,"uuid":"uuid4","alter_id":0,"tls":{"enabled":true},"transport":{"type":"grpc","service_name":"svc4"}}},
  {"raw":"vmess://uuid5@srv5.example.com:443","tag":"vmess-5","type":"vmess","config":{"type":"vmess","server":"vm5.example.com","port":443,"uuid":"uuid5","alter_id":0,"tls":{"enabled":false},"transport":{"type":"ws","path":"/ws5","host":"vm5.example.com"}}},
  {"raw":"vless://uuid1@srv1.example.com:443","tag":"vless-1","type":"vless","config":{"type":"vless","server":"vl1.example.com","port":443,"uuid":"uuid1","flow":"","tls":{"enabled":true,"sni":"vl1.example.com"},"transport":{"type":"tcp"}}},
  {"raw":"vless://uuid2@srv2.example.com:443","tag":"vless-2","type":"vless","config":{"type":"vless","server":"vl2.example.com","port":443,"uuid":"uuid2","flow":"xtls-rprx-vision","tls":{"enabled":true},"transport":{"type":"ws","path":"/v2","host":"vl2.example.com"}}},
  {"raw":"vless://uuid3@srv3.example.com:443","tag":"vless-3","type":"vless","config":{"type":"vless","server":"vl3.example.com","port":443,"uuid":"uuid3","flow":"","tls":{"enabled":false},"transport":{"type":"none"}}},
  {"raw":"vless://uuid4@srv4.example.com:443","tag":"vless-4","type":"vless","config":{"type":"vless","server":"vl4.example.com","port":443,"uuid":"uuid4","flow":"","tls":{"enabled":true},"transport":{"type":"grpc","service_name":"svc4"}}},
  {"raw":"vless://uuid5@srv5.example.com:443","tag":"vless-5","type":"vless","config":{"type":"vless","server":"vl5.example.com","port":443,"uuid":"uuid5","flow":"","tls":{"enabled":true},"transport":{"type":"tcp"}}},
  {"raw":"vless://9ee9e993-8358-4ac4-a5d5-080660fed4d5@185.124.175.39:443","tag":"vless-cloudflare","type":"vless","config":{"type":"vless","server":"185.124.175.39","port":443,"uuid":"9ee9e993-8358-4ac4-a5d5-080660fed4d5","flow":"","tls":{"enabled":false},"transport":{"type":"tcp","header":{"type":"http","request":{"method":"GET","path":["/"],"headers":{"Host":["cloudflare.com"],"User-Agent":["Mozilla/5.0 (Linux; Android 10; K) Chrome/126 Mobile"],"Accept-Encoding":["gzip, deflate"],"Connection":["keep-alive"],"Pragma":["no-cache"]},"version":"1.1"}}}}},
  {"raw":"trojan://pass1@srv1.example.com:443","tag":"trojan-1","type":"trojan","config":{"type":"trojan","server":"tr1.example.com","port":443,"password":"pass1","tls":{"enabled":true,"sni":"tr1.example.com"}}},
  {"raw":"trojan://pass2@srv2.example.com:443","tag":"trojan-2","type":"trojan","config":{"type":"trojan","server":"tr2.example.com","port":443,"password":"pass2","tls":{"enabled":true}}},
  {"raw":"trojan://pass3@srv3.example.com:443","tag":"trojan-3","type":"trojan","config":{"type":"trojan","server":"tr3.example.com","port":443,"password":"pass3","tls":{"enabled":false}}},
  {"raw":"trojan://pass4@srv4.example.com:443","tag":"trojan-4","type":"trojan","config":{"type":"trojan","server":"tr4.example.com","port":443,"password":"pass4","tls":{"enabled":true,"sni":"tr4.example.com"}}},
  {"raw":"trojan://pass5@srv5.example.com:443","tag":"trojan-5","type":"trojan","config":{"type":"trojan","server":"tr5.example.com","port":443,"password":"pass5","tls":{"enabled":true}}},
  {"raw":"hysteria2://pass1@srv1.example.com:8443","tag":"hysteria2-1","type":"hysteria2","config":{"type":"hysteria2","server":"hy1.example.com","port":8443,"password":"pass1","tls":{"enabled":true,"insecure":false},"opts":{"obfs":"http","obfs_password":"o1","fingerprint":"fp1"}}},
  {"raw":"hysteria2://pass2@srv2.example.com:8443","tag":"hysteria2-2","type":"hysteria2","config":{"type":"hysteria2","server":"hy2.example.com","port":8443,"password":"pass2","tls":{"enabled":true,"insecure":true},"opts":{}}},
  {"raw":"hysteria2://pass3@srv3.example.com:8443","tag":"hysteria2-3","type":"hysteria2","config":{"type":"hysteria2","server":"hy3.example.com","port":8443,"password":"pass3","tls":{"enabled":false,"insecure":false},"opts":{"obfs":"ws","obfs_password":"o3"}}},
  {"raw":"hysteria2://pass4@srv4.example.com:8443","tag":"hysteria2-4","type":"hysteria2","config":{"type":"hysteria2","server":"hy4.example.com","port":8443,"password":"pass4","tls":{"enabled":true,"insecure":false},"opts":{"fingerprint":"fp4"}}},
  {"raw":"hysteria2://pass5@srv5.example.com:8443","tag":"hysteria2-5","type":"hysteria2","config":{"type":"hysteria2","server":"hy5.example.com","port":8443,"password":"pass5","tls":{"enabled":true,"insecure":false}}},
  {"raw":"hysteria://108.181.24.77:11512?insecure=1&peer=apple.com&auth=dongtaiwang.com&upmbps=10&downmbps=50&alpn=h3#ðŸ”’ HYSTERIA-UDP ðŸ‡ºðŸ‡¸ US-108.181.24.77:11512","tag":"hysteria-1","type":"hysteria","config":{"type":"hysteria","server":"108.181.24.77","port":11512,"password":"dongtaiwang.com","tls":{"enabled":true,"insecure":true},"opts":{"peer":"apple.com","upmbps":10,"downmbps":50,"alpn":["h3"]}}}
  ,{"raw":"hysteria://51.159.226.1:14241?alpn=h3&auth=dongtaiwang.com&downmbps=100&peer=apple.com&upmbps=100#ðŸ”’ HYSTERIA-UDP ðŸ‡³ðŸ‡± NL-51.159.226.1:14241","tag":"hysteria-2","type":"hysteria","config":{"type":"hysteria","server":"51.159.226.1","port":14241,"password":"dongtaiwang.com","tls":{"enabled":true,"insecure":false},"opts":{"peer":"apple.com","upmbps":100,"downmbps":100,"alpn":["h3"]}}}
  ,{"raw":"hysteria://130.61.24.219:443?mport=6000-21000&insecure=1&auth=483f8ef7-8480-490d-92fb-1fc392fb34b6&upmbps=30&downmbps=70&alpn=h3#ðŸ”’ HYSTERIA-UDP ðŸ‡©ðŸ‡ª DE-130.61.24.219:443","tag":"hysteria-3","type":"hysteria","config":{"type":"hysteria","server":"130.61.24.219","port":443,"password":"483f8ef7-8480-490d-92fb-1fc392fb34b6","tls":{"enabled":true,"insecure":true},"opts":{"upmbps":30,"downmbps":70,"alpn":["h3"]}}}
  ,{"raw":"hysteria://51.158.54.46:55396?insecure=1&peer=youku.com&auth=dongtaiwang.com&upmbps=11&downmbps=55&alpn=h3#ðŸ”’ HYSTERIA-UDP ðŸ‡«ðŸ‡· FR-51.158.54.46:55396","tag":"hysteria-4","type":"hysteria","config":{"type":"hysteria","server":"51.158.54.46","port":55396,"password":"dongtaiwang.com","tls":{"enabled":true,"insecure":true},"opts":{"peer":"youku.com","upmbps":11,"downmbps":55,"alpn":["h3"]}}}
  ,{"raw":"hysteria://185.22.155.71:10803?upmbps=1000&downmbps=1000&auth=dongtaiwang.com&insecure=1&peer=www.bing.com&alpn=h3#ðŸ”’ HYSTERIA-UDP ðŸ‡·ðŸ‡º RU-185.22.155.71:10803","tag":"hysteria-5","type":"hysteria","config":{"type":"hysteria","server":"185.22.155.71","port":10803,"password":"dongtaiwang.com","tls":{"enabled":true,"insecure":true},"opts":{"peer":"www.bing.com","upmbps":1000,"downmbps":1000,"alpn":["h3"]}}}
]